Title,Company,Date,Location,Salary,Summary,Link
D365 AX Developer,Agility Business Solutions,30+ days ago,"Cleveland, OH",no data," What you’ll do as a Developer:HTML5, CSS, JavaScript, ASP, Python, XML and SQL skills are a plus, as is familiarity with Microsoft Visual Studio development…",https://www.indeed.com/pagead/clk?mo=r&ad=-6NYlbfkN0Bx1fXn6alTMpFeDNCF4CS42N3f1cgysk8lkLxcSpX4r2tjKoEiTmILkqOeTpt8w6M9xPUEsPPWrwtHl7Jg2l6-UGik6s7fVaCVVXxQ0YRWcY_UB8gB-k5HDLL5rXceEPhIN2hSF1525NWnZGngTWbtuvtJsBjNDpoDhIXXGOt0Anjc2b79PKbzTfW4I4f48h3IiwFbwRO3jjCF-bzGHEEZZNGKkvqjP-LOZ0R01OdtghatEs9KeNUoWQ-rstwmBgP1q4Lr4YuLVFvl5A0C24LSctppz8JdOdYYgiAt3sEmXjlGednrKMoY2_VrFJGFnJWUrI5oVrR0X6ZGo0TamkIolNDcP_Woy1X6uF1NPQ8PVollR9pfKPrrhIfNMzd4CpWNiD-HVNNDX2fVTvmXhXILRgwmf1x-GMfZKpBlVCXHg20NtQOCmYy3rVstJcD4ME0MQ0ZpY8Jld53DSry4yDi_c2tRjet-6dg=&p=0&fvj=1&vjs=3
Entry Level - Software Developer,Smoothstack,25 days ago,United States,"$55,000 a year"," Basic knowledge of Java, C#, .Net, Python or similar programming languages.New college graduates are welcome to apply.",https://www.indeed.com/pagead/clk?mo=r&ad=-6NYlbfkN0ChdE_-3s9UeG5xYsqO3th9AddXeBq2OieSfAM8evhI-PZ76-Buf7EcnCv0gKKLndR0YEV2kTxuAD_VKH6HEbZFGsVNkpiitjOp_daSiXpE3Pd_X3qe-bekUwRlgzVovAcCBt0z5yUU5xFBeE38vP8NN1cwM2zQW5_7-qCme8EqiiMFCG2Ay2jEH-2PMMNDP6_CLas3HWok3fik_jUfoqH1dmU9uEIjKfBu-xZvJ0N07P8-JWHxlBkLUe1nT3n_i709kF_6ZI2BiSd3rMt-K3En3YmkdYrgJeshG3ZUi93ahbPduc8uD4-oGAA8FDBnYFAyqLKlKRrJXCEDd9F66Q6KpdNdhsNq75zNY3d6qq-e1ik8-AEIMaYzCTO68SAdgd8KArJXCZsmS-C6pDDo-XBiIBZm_4ZpIcJWIfEDiaYWZC7_ck0jNheg4VkrU0hdF69XbjmaQAvFS7tr2-ZQY2F11vLMYCYkaAw=&p=1&fvj=1&vjs=3
Quality Assurance Engineer,Patriot Software,16 days ago,"Canton, OH",no data," Scripting languages for test automation e.g., Ruby, Java, Python.We are looking for a Quality Assurance Engineer to join our fast paced development team.",https://www.indeed.com/pagead/clk?mo=r&ad=-6NYlbfkN0BHedpvpXdEsaK4PWVik6d5d_gh7qP0dihMo_Ne_EB-Xj3H3RHAqMxAomrCTkelnw3wJ7l-FtkJMDoFcJdVWhvFlWpo8MWRKIst8zAWJbrPccAm3MjAnlRHbOxZmJ6rlZeWWeXHimqOQEAUBVEN5b0zKGwKviv7egBBRlRt2MmoChDrFArViNUwT3KhDhvD3QVtxUMYol3GjRK3xP9MXb701sirqloJ7OWOMquZTCUwCL8WBMFZ82b-uJQKaeINjSM3IULbqXFO0uaGbcZ4ctd0GMT76f-nUOUY5zOjwmm9znHABaKk6MR26jBtpGMSVmWiMDFbVzJ2Fh9tUw9NciFnqSIhtjUfNBvQbu_7WU8ceMlFX-JTeDr_vHGcURau4rmzgIr6t-e3S7m1Lbxs4Vac-IF-_yNU2lwCocMB7nscgKWPu87KL2JhSzaU66_G7kgDdb3vr6cVbAlqZudOvoeICN3Tg_IVSBvK4C9x1f8w1Q-wFyF_SIlPzIgqjMAqQOrXNJ0WxEhL9i52QFvGf3xAy3E3O5hZv81fGf-Yoivz_eTEAvKzXMA7SPY7OBavlkVUewL9IPxaspKmBFF61lAFjTNGSJudtEmIgjcfgKzxLWKA-r9kX72VGUdGVvD0d8xvY3N9BNNVDUq_91_ifBpu4dNFsZrCjHI=&p=2&fvj=0&vjs=3
Python/Django Developer,"Incyte Studios, LLC",9 days ago,United States,$50 - $60 an hour," Incyte Studios, LLC is a software development agency specializing in the Energy Sector.Our most immediate need is for a full stack engineer with Django,…",https://www.indeed.com/pagead/clk?mo=r&ad=-6NYlbfkN0DtQV-LeLldfQmgz-cqQl_HAZvaYDzY3V082QIM5xmnAYgPKQmoGnVNA6eA-_-ieXUqrX7SggKIolFQqzY-fIp1u0YOe5yBkdgdPWrHKdAPZs56GulV6Bh3xFHyzc-7lxkoJf2GhqerOsP_jXM7ftCyyIdkx10RU4QWxM5cmQ3ryXALAaDzs4bfYd26lQm8S4Xh5rjCLWxQ-S5KDta7SoNhRZ1tKO7zdZ-86rtRDMFGDvdHkw1twJ7XUABR_XIr32YIEHXJzGsmFiV3f_g0HNEbpHsgTJ7NnmNrvFzEWX7ujow2kbH10sh5PzIHju40WTi_7jEM-Z2lV53jqaAX7xpSDPix03Nw272k-ZS2NhFZZDswYjelo-Bocs7Fg-SShtO8JZfiyrED_-gBEg8zINMoXkRtRlKNUkOgehhSUOwP4I8RXr8xJaSIR0BgP0IwsGVOLrXgh-aar6_Ddu81iUKu&p=3&fvj=1&vjs=3
Sr. Python Developer,Adwait Algorithm,10 days ago,"Mayfield, OH",no data," Snowflake, Redshift, BigQuery, etc) as a heavy user or developer.Ability to exhibit programming experience / skill in Python, Scala, or Java (Experience with…",https://www.indeed.com/company/Adwait-Algorithm/jobs/Senior-Python-Developer-79b4d58c11baa98e?fccid=7ea19ebd63bdf7db&vjs=3
Python Developer,ReCharge,2 days ago,"Cleveland, OH",no data," Python (preferred), Node.js, Ruby, Java, Go.We're looking for a Python Developer to join our feature team and collaborate on a critical part of the platform by…",https://www.indeed.com/rc/clk?jk=c826327dfd37f5f3&fccid=dfd75c6c8aa801a9&vjs=3
Backend Developer,Findaway,12 days ago,"Solon, OH 44139",no data, Findaway is seeking a skilled and successful Backend Developer.Comfortable writing documentation for consumption by our developer customers.,https://www.indeed.com/rc/clk?jk=70caef15863ec0f0&fccid=04b40f7be7960fc9&vjs=3
Business Intelligence Developer I,ExactCare Pharmacy,9 days ago,"Valley View, OH 44125",no data," May have duties that include data manipulation, transformation, and automation using appropriate programming languages such as SQL or Python.",https://www.indeed.com/rc/clk?jk=a2c63ebce462e019&fccid=7d1466639cc4bfa1&vjs=3
Informatica Developer,transaction.agency,19 days ago,"Cleveland, OH",no data," Able to write Unix Shell scripts integrating SQL, Perl or Python.We are looking for am Informatica Developer with a strong background in software development…",https://www.indeed.com/company/transaction.agency/jobs/Informatica-Developer-1102b168212ae3c0?fccid=d2536c6daff5fec9&vjs=3
Data Warehouse Developer,Matco,30+ days ago,"Stow, OH",no data," Experience with R and Python preferred.Senior Data Warehouse Developer, Business Intelligence Architect.Develop and maintain Business Objects Universes.",https://www.indeed.com/rc/clk?jk=b2a0fb6972966f1a&fccid=aca93348b9d7d157&vjs=3
Software Developer,PNC Financial Services Group,16 days ago,"Strongsville, OH",no data," As a Software Developer within PNC's Retail Technology Data MIS organization, you will be based in Strongsville, OH.Individual will be part of the Data Team.",https://www.indeed.com/rc/clk?jk=c5fae8ca1ec06618&fccid=b1330bfa6e5aae73&vjs=3
Application Developer,Goodyear,30+ days ago,"Akron, OH",no data," Preferably Python, Java or C#.Python experience is a plus.This role will support Global Technology’s Innovation Beyond Tires strategy.",https://www.indeed.com/rc/clk?jk=ced27d256f7d832d&fccid=e451672f561ffb08&vjs=3
Solutions Developer,Tufin,12 days ago,"Fairlawn, OH",no data," 3+ years of programming experience, with a strong knowledge of Python.As a Solutions Developer, you will be responsible for developing customization &…",https://www.indeed.com/rc/clk?jk=03f8bd0c827d0c01&fccid=e60f2049f655b8d4&vjs=3
Web Developer,FortisureIT,25 days ago,"Akron, OH 44312",no data," Experience using C#, PHP, JQuery, Bootstrap, .Net and Python.Located in Green Ohio, FortisureIT is currently looking for an experienced, open-minded and…",https://www.indeed.com/company/FortisureIT/jobs/Web-Developer-48ff75aa079cb5b1?fccid=82aad26a4dad8491&vjs=3
Software Engineer,Complion,26 days ago,"Cleveland, OH 44115 (Downtown area)",no data, Complion recently won “Best Growth” and “Startup of the Year” and we’re looking for an up and coming Software Engineer to join our growing cross-functional team…,https://www.indeed.com/pagead/clk?mo=r&ad=-6NYlbfkN0C8fsZAUwot6QlMprF6kLU8IkgjbiU5mN9OqR1WV3Drrrq7INcsIBLuBUt8JeBO45Yknz7n6s-nogG6UnQiMrBzXq7ojDMkM1DaEFD3gfvvZDQkwe7wx2nT-8IVgu2hgx48BOA2gF326ZSZTSAVbsYO-0HJ1qp85pK9LHJRVthALWH-KCKiLAEsq7eT5bHdMKLiTjXVB9_r6QLsEddVzC4dQF3lOdxsWYgEuUXDGJ4Gb9eX3Ephbf0gapOERV_9o2NJ2nRiBFUIMt7uV5AXIItLuFS-Y78dDvaPmQgopIt-UIQLA2Y8csMTXvCqkyu6SdUOZYCMls8EVQCbSRSBcL3IuRbzNlgafxDt9G5VqvOPtjwc6a1s6DYWzTVZdLi7xfQCdu7eQMs5zqr7TihCSECabrU7CPm0kWLX9dZg6ZTT208s485yTs9NZeIuRHqkywaF3yNKOuE0kPMgtdIkW5nt&p=14&fvj=1&vjs=3
Entry Level - Software Developer,Smoothstack,25 days ago,United States,"$55,000 a year", We have multiple openings in and around Washington D.C.(Metro area) and no prior work experience is required.Excitement and eagerness to learn new technology.,https://www.indeed.com/pagead/clk?mo=r&ad=-6NYlbfkN0ChdE_-3s9UeG5xYsqO3th9AddXeBq2OieSfAM8evhI-PZ76-Buf7EcnCv0gKKLndR0YEV2kTxuAD_VKH6HEbZFGsVNkpiitjOp_daSiXpE3Pd_X3qe-bekUwRlgzVovAcCBt0z5yUU5xFBeE38vP8NN1cwM2zQW5_7-qCme8EqiiMFCG2Ay2jE_9qHrbxnkqUuhqmdjBeHLhdhzVwl06zJ0VvP_jaRkDuVLlON1lOoITcVJsCsyM8NwopI17ojUkQq84ZvXiO7nbyInF909JCjvBc6NOA9GVIfz1-hztVrTutazLXAQuoLlJz5Me-jvkDDk19qaVm6RTZKj3K1EPqopRpMIk3GtavWNcYbiXOcg8WTcnCaBD1cr_SWSoUhXyDltdCNDjfTSMjbpGKpxybR7xBq_5Y0rv77sb0u3AI2GCn9iz26ErYZf5tao1wE8rGBahiG8H7sjel_sMvMfUx_gvf_yDD4ZkI=&p=0&fvj=1&vjs=3
Software Engineer,Complion,26 days ago,"Cleveland, OH 44115 (Downtown area)",no data, Complion recently won “Best Growth” and “Startup of the Year” and we’re looking for an up and coming Software Engineer to join our growing cross-functional team…,https://www.indeed.com/pagead/clk?mo=r&ad=-6NYlbfkN0C8fsZAUwot6QlMprF6kLU8IkgjbiU5mN9OqR1WV3Drrrq7INcsIBLuBUt8JeBO45Yknz7n6s-nogG6UnQiMrBzXq7ojDMkM1DaEFD3gfvvZDQkwe7wx2nT-8IVgu2hgx48BOA2gF326ZSZTSAVbsYO-0HJ1qp85pK9LHJRVthALWH-KCKiLAEsU7iMyDpha3Iw4wLKCod5tKWVtNFngwddOLqN6RCcSbuA5Dd9pd4VDK_eNDWyFTp15vZXNSX346X7qB6ARcovLkYLX_2oAsWG2_oY7Gb7OOvK4-D73BwFpb_JU8LGl3lfi10PCa7jFydaLNYfJ80BECU6aTNzlrIl631zWv93ht5v07Co0_ab9ev5nP6eIFzWti8vGrEL3TF4hSZX3cuU54rGq3rZfrQJLv8EQkCyBEWGRF06Xh9U5PSTp7gvdMim9RNz-cfm7RoRR8He8xUUg2zgVErO0bGi&p=1&fvj=1&vjs=3
Python/Django Developer,"Incyte Studios, LLC",9 days ago,United States,$50 - $60 an hour," Incyte Studios, LLC is a software development agency specializing in the Energy Sector.Our most immediate need is for a full stack engineer with Django,…",https://www.indeed.com/pagead/clk?mo=r&ad=-6NYlbfkN0DtQV-LeLldfQmgz-cqQl_HAZvaYDzY3V082QIM5xmnAYgPKQmoGnVNA6eA-_-ieXUqrX7SggKIolFQqzY-fIp1u0YOe5yBkdgdPWrHKdAPZs56GulV6Bh3xFHyzc-7lxkoJf2GhqerOsP_jXM7ftCyyIdkx10RU4QWxM5cmQ3ryXALAaDzs4bfNwhEbzbMIso2GDw7IWJcCUdSermQyYl-fnfPHr0krQh0WUWRKskkW73oyrcV3Y06Iqu69dyYG_fCHWFn5_bn1uKn-tHiPTICSwvO4Q15l07kpKlq1ZP0vapjHPbt4ReTafbAn0q_zbcxwmcXesn_uIeQmLnVGQXUSbUtOe2gC3wpT01n0rMjand89K73B5e6uO_UIdC-1ryuidsIGT_7P1QXKUu6XavBpQsAJzitdvD5Ir31qIDq9i-NCEPH1XhPwBrF15lk1VuFAVTQV1iXlvLsykUi2E0m&p=2&fvj=1&vjs=3
Java Developer (Entry Level),www.advantecs.com,4 days ago,United States,"$55,000 - $65,000 a year", Shortlisted candidates will have initial interview with the Employer t and selected candidates will be on-boarded into a Corporate paid internship upskilling…,https://www.indeed.com/pagead/clk?mo=r&ad=-6NYlbfkN0DIjBdOhcvN-vt2b7UpMuy1LIBG3msLj6vp7TuM2Ezbx0WFT323hYkzSzzDgW0oVmEPfOXyFIXIVGJJ7Lyoy5L7iPSGf_Y4T3hkXmUnDaYuNWjthhu83GA4a3H6bP5CPQ_23rw9pB2lN6gMP2Z3sbw3n05nT66iLHIrgcO6nvG5X54RlW0SP5gNgWTrK1X0g18gLNcshOLcaH5s-QpUBds7E-5P4h94Cj7a3vCahl23EG_b8H5vfi2cYbd47NHAz9ZGro-tiUbCHNQf6FnZIxTsglPuQZiVqvq9ULnheI3VT9El7HNtoyP9W3hq15qkbPkgTCUa4dFClsleVu9NnAUtjwhucDDNShzc7LlYdNpHeRSuyR5CVQuGb04WY-Wg-h6NEKFBY80pud7CCRFjtzEHwiZzYoFs9I1tmiVOv7P-Fx-LcTHIinU1vUDnwxS0Su0lxSFiGHL0VXYqcaQ4XaUQzIPVQBY2XP8=&p=3&fvj=1&vjs=3
DevOps Engineer,Patriot Software,22 days ago,"Canton, OH",no data," Experience programming in Bash, Power Shell, Python, PHP, Go, C#.You will be part of a talented team of engineers that demonstrate superb technical competency,…",https://www.indeed.com/pagead/clk?mo=r&ad=-6NYlbfkN0BHedpvpXdEsaK4PWVik6d5d_gh7qP0dihMo_Ne_EB-Xj3H3RHAqMxAomrCTkelnw26ZdexNurz9rh1pHgZr2AR_r0L0HxzIibjzza9Uj2DtdNA-8YJcYxxa7qDhzhSbod2e3r3Xdjq1l-8NEZS23NetET9R_0oAl-wLqTE4tabFJcytrpu-WnLRcXVMB03ocsrMevLhiCp57rlwNuqnVkvqm9SgHwg40zTnq4aG2ZfnKmOuJg5DXBFz2BiuWJ0CJEI4qe1q3lje3oI7GWQjzVzJnl0xD1v8muIaG8G7qfZ_nu7rCaTcsAqyxNYZ2grJiBjR4W5Z8GV09aq-tHJxAQ04jr7UuFZHVqAQ-0c62tz8-xN-g-gsMOp_vbpBIFaLnNMjrSwo8iWG8h2xkDlIO0xuE8vVCOhd6lsTyTysqyz93ya1cc8JGA-4PGfo9T6gCX_RSyVjRw9aG0OtwExKoXK_a81tM2F8OrVjHTubeiLGvVz2NbHKigbOiDPT5aptRdBatrcmddK7W-toBwKjUt0Sqt6xmo83RyD_-VufRD6paH0vAU86RysXsG55lrseg7-yAyD0EgOyvb3mR18G-L2PIkA_JWMHbJX2o3OBLpKnsGKmrfm3kvBA55zaoV4eTtscKMOk1BxlS8qx_knbDJV3u-py-r11TI=&p=4&fvj=0&vjs=3
Web Developer,FortisureIT,25 days ago,"Akron, OH 44312",no data," Located in Green Ohio, FortisureIT is currently looking for an experienced, open-minded and versatile web developer who is eager to work towards implementing…",https://www.indeed.com/company/FortisureIT/jobs/Web-Developer-48ff75aa079cb5b1?fccid=82aad26a4dad8491&vjs=3
Software Engineer I,Find.Jobs,2 days ago,"East Cleveland, OH","$45,000 - $80,000 a year"," Think of your job search right now.Irrelevant results, poor page speed, annoyingly useless filters.At no other business will you have the opportunity to…","https://www.indeed.com/company/SecondGeneration,-Ltd./jobs/Software-Engineer-a1ca9d57df7f01ff?fccid=b2b9bb5acf21d3f5&vjs=3"
Senior Full Stack Developer,AVALUTION Consulting,30+ days ago,"Cleveland, OH 44101",no data," Avalution is looking for a passionate senior developer to join our full stack dev team based in Cleveland, Ohio.Docker (or other container technology).",https://www.indeed.com/rc/clk?jk=7f053b4b14ae8e70&fccid=d244d566b6941cde&vjs=3
Python Developer Senior to Lead,Progressive,30+ days ago,"Mayfield Village, OH",no data, Python Developer Senior to Lead.The Digital Marketing team is in need of a full stack Python developer to build an internal web application to support Digital…,https://www.indeed.com/rc/clk?jk=5673d419bed97284&fccid=082e59b71e3e4fe2&vjs=3
Software Engineer - Analytics,DialogTech,1 day ago,"Cleveland, OH",no data," You will work with multiple languages such as Python, PHP, and Javascript as well as key AWS tools and services such as EC2, SQS, Lambda, and Kinesis to deliver…",https://www.indeed.com/rc/clk?jk=782ca9b2dfd992e5&fccid=825d153aec833ca2&vjs=3
Big Data Developer,"CGI Group, Inc.",Today,"Cleveland, OH 44114 (Downtown area)",no data," 6+ years of experience with HIVE, Sqoop, and Python.CGI has an an immediate opening in Cleveland OH for an experienced BIG Data Developer with 6+ years of…",https://www.indeed.com/rc/clk?jk=86aa1a754c5f268c&fccid=d2841a5c0380b93d&vjs=3
Software Engineer I,"ZIN Technologies, Inc.",22 days ago,"Cleveland, OH 44130",no data, Completed related tasks within Python with multithreading support.Provide software solution to meet the needs of the laboratory testing capability of the…,"https://www.indeed.com/company/ZIN-Technologies,-Inc./jobs/Software-Engineer-05976c639fa409b0?fccid=5c16398b13e23042&vjs=3"
Embedded Software Engineer,Theiss UAV Solutions,4 days ago,"Salem, OH",no data," Must know C++, Linux, Ubuntu, Python, and ROS (Robot Operating System).We have need for embedded software engineers/programmers that can work in C++, Linux,…",https://www.indeed.com/rc/clk?jk=c4f4a7b62750396f&fccid=56dd5f869337ad5a&vjs=3
Senior Industrial Applications Developer,Sherwin-Williams,3 days ago,"Cleveland, OH",no data, The developer will create new and maintain existing SWBatch applications and work closely with the Watson team to provide Historian links to these SCADA systems…,https://www.indeed.com/rc/clk?jk=ec5ef6aaf2aa7655&fccid=94f8a3a6ac5079e2&vjs=3
Sr. Application Developer,Goodyear,30+ days ago,"Akron, OH",no data," Preferably Python, Java and C#.Python experience is a plus.This role will support Global Technology’s Innovation Beyond Tires strategy.",https://www.indeed.com/rc/clk?jk=8133fa86c090b232&fccid=e451672f561ffb08&vjs=3
Back End Software Engineer,LeafFilter Gutter Protection,5 days ago,"Hudson, OH 44236",no data," Enhance DevOps practices and developer tooling.Work with a modern and diverse tech stack, with technology ranging from PHP to Python and C#/.NET.",https://www.indeed.com/pagead/clk?mo=r&ad=-6NYlbfkN0CN4HTjSpg-URDVZANUOzLoPqX2aI5Mvt-Jtbs12J84vVM3iprtXOwptmWfEiCtzqIpeHxNS7b2rjXzoHLdM8o5vrjhoxe7_dtcc-Gl3fx_aVdA6a3uGZ8Mj_LpF24KujoxWsJa7f8sPPqBBOxl1_nd4rTmoGlZTpwOlU7GOTliP53SivB5friexJ4arwvHUAqdvT2-pzd4PvWhcAn8aogxy0oYtQJ1y-IOKjvpcVy3bprJALj-h__C8oGTPXDHsoX-EL3XeG2A2xW7Qmyev85I8qbPOQEEBKtYZWp7Ya_uNyw_kCV575XyMWpIb4VvlwX0HBWezz3F-9QlAl8SpJCNbZOoSkhr81vxdgWqbfR9KeNr1sKSgR6vq3_qcApivpfkKRn8IZSP-T0UCzM3ifba7GZLyWlFQBMc5j4xyY04rsDMjP-3Rc3NQ8PYP_-0ZJhEuvd8rfTe8IvK_8YXucTkbEsXvQcCe7civ6VdL7pRqiUuBWpNko84CzpLtk8Mizf69sU6B-vWIDLqzFUMBRDlSSS0oTqLUI6g5AahNFUCYLy52o42oCRZVMPALdjKC2iws0gkBIfsjOcF9lCT87-gzFix7akVKainZXrdRlAr_cgxmhS77p0RnAIr8SOHpTU=&p=15&fvj=0&vjs=3
Quality Assurance Engineer,Patriot Software,16 days ago,"Canton, OH",no data," Scripting languages for test automation e.g., Ruby, Java, Python.We are looking for a Quality Assurance Engineer to join our fast paced development team.",https://www.indeed.com/pagead/clk?mo=r&ad=-6NYlbfkN0BHedpvpXdEsaK4PWVik6d5d_gh7qP0dihMo_Ne_EB-Xj3H3RHAqMxAomrCTkelnw3wJ7l-FtkJMDoFcJdVWhvFlWpo8MWRKIst8zAWJbrPccAm3MjAnlRHbOxZmJ6rlZeWWeXHimqOQEAUBVEN5b0zKGwKviv7egBBRlRt2MmoCrXJmq54LcWYOBgkteMXuENl9x036tM4yBCacbTFqKIAhXCncp9DLhWyuIbOFwSicJUNXfs4LypbTrk8GCYqWKYw3bwt4TB8ovY-Fmw607nDv4ee_yflfvPXhPMvi68UgI0h2S90n9GwLIxr6Rggz7a-gQ_KWlQWBVus1mJjH-KS4uf9v7dlgwwuA3toLcIEaWbKh5jN9Te8T_RrVrZOYMh7hAwceMQYv1eYDjbeGSMIm8RCGQHhCRV3__tmtvQl_ELcg8ynUUz48pQxHcNnXwAkGCXkmEDcGniGAVNgn_jJFTQ6n8LpzmNWTW1TX-fdoc7uoJCp4d9RK19xGjkttBKf1OaRFFyAYXIxGCoT-9Ihjf8_uAwhQ_2JzcsUZdBfHRsUQAKXaLar3Iy5Ajr56WbbHWxAxU-kfzh9eIoHAbsKeA6JeKYJPlVIA2QPrFyAiunWs8WR7t4Kq3JTmUPTaprpswvjSJWry-3ecPNg4niBb0q0XhfonlY=&p=16&fvj=0&vjs=3
D365 AX Developer,Agility Business Solutions,30+ days ago,"Cleveland, OH",no data," What you’ll do as a Developer:HTML5, CSS, JavaScript, ASP, Python, XML and SQL skills are a plus, as is familiarity with Microsoft Visual Studio development…",https://www.indeed.com/pagead/clk?mo=r&ad=-6NYlbfkN0Bx1fXn6alTMpFeDNCF4CS42N3f1cgysk8lkLxcSpX4r2tjKoEiTmILkqOeTpt8w6M9xPUEsPPWrwtHl7Jg2l6-UGik6s7fVaCVVXxQ0YRWcY_UB8gB-k5HDLL5rXceEPhIN2hSF1525NWnZGngTWbtuvtJsBjNDpoDhIXXGOt0Anjc2b79PKbzl2bxfi0ByeHZtxOWSaoQvyJJ8y9DzaGrJIgeOjZpJ33quvRszn1fLnIUKjyvDnaQaB5FqYLgXPngig9MVl2LTyVonSJi9FPpwHBGpIwq7hj37pTJQ-FZEPhjiof4nXGmncB2umi8eWGiq74izAMmDkZyRb9VkUfcYIGaFpT974aySUdTsGSqfRNI3SxGsEbi71uN-tEq_Npxog18BoIUNkzE2VByhqS2IrpWbC-ZlmHuNgS0Jo-4j977n6ssr7Tc1ohKbycgAo53PWNAaGiQ8LDdYbzPG5CNYzfFt1oMuZg=&p=17&fvj=1&vjs=3
Sr Application Software Engineer,The Timken Company,30+ days ago,"North Canton, OH 44720",no data," Familiarity with common protocols and languages (http, ftp, HTML, XML, JSON, MATLAB, LabVIEW, Python, Javascript, R, etc.).",https://www.indeed.com/pagead/clk?mo=r&ad=-6NYlbfkN0Cx0OrPzCAuK2R1MRT2pFqDWoS6NgHx-402lOBEwKTcTgTVbEJapIPsymrlMZCMmAiQdJLjQgDtCteLJBbTmsLidOOShXjAHYwlAvvqTWg1pSCDyDI2_qt2FN-sNx8pxRG8mC0U2nvDQtb1DaRGEqsNV1UGUlZ8yi4I0xV9TnmJjjg9rGhY58u_ComIalB0Y3hemWXjuzW4L05tUC77d2T1xeN_nBBW1PUKTrbWGN5FvsZ7p04-Ab1UxH8M7BbMf0Cif5G_yhAHJ7heYpRQOYFgluuonDoV5MgS4WXaprxjkrYbc_y5WlAWq5HCkX7JtJiDYskaGNQt7rYYlLsmCc_aVuZAJO24f13MfJ970_wxvcKcsyW7min0kWaEatp5EIT05JE3Wbg8vnfgdhqGmZ4qFq_Ozgo7q_JN0NcK7OgF72SS6r-w_7E2oT1hkaE2hCf5tTPT_ThPcTYoN0QSst3ieavsBOUJiumAZ9WjvnhKeBkYvNaWC3FMpwR2gp3lhRtoe0IBEo-iRmrSRVPPRBC-zc_Loj53MP129rS98Ao6J3z7qZjmJt7auQNpd8NL3w0pYrtoe_qisg==&p=0&fvj=0&vjs=3
Java Developer (Entry Level),www.advantecs.com,4 days ago,United States,"$55,000 - $65,000 a year", Shortlisted candidates will have initial interview with the Employer t and selected candidates will be on-boarded into a Corporate paid internship upskilling…,https://www.indeed.com/pagead/clk?mo=r&ad=-6NYlbfkN0DIjBdOhcvN-vt2b7UpMuy1LIBG3msLj6vp7TuM2Ezbx0WFT323hYkzSzzDgW0oVmEPfOXyFIXIVGJJ7Lyoy5L7iPSGf_Y4T3hkXmUnDaYuNWjthhu83GA4a3H6bP5CPQ_23rw9pB2lN6gMP2Z3sbw3n05nT66iLHIrgcO6nvG5X54RlW0SP5gN2_QM6i5r0J-kCH-VTjwJUs3HgjzHLdaL-7mI3sQQxQ0y4emjqEUpJ7xNstf7mN-mn03v_GSl5zOsVZ8wcAe_W-One0TfTyGfjgj8edcyxhXZOjEMK2an_HeRj2bcx5VG2KPVhP2e969TwCzuznmtImlizIrIFiIwBoV862wOMR6uYDOiHw_sTfKqUKCaq6kMQT5MuXtTTmb-ZKuTX_jv7BcDORY66BFhKpsoUWo9QE39bDoPiQtNJ7bqqcLLmXiNkrbm-hM3WJtMwXFk2WDGvIlHN91HnFQHcfX0nU_qAIg=&p=1&fvj=1&vjs=3
Entry Level - Software Developer,Smoothstack,25 days ago,United States,"$55,000 a year"," Basic knowledge of Java, C#, .Net, Python or similar programming languages.New college graduates are welcome to apply.",https://www.indeed.com/pagead/clk?mo=r&ad=-6NYlbfkN0ChdE_-3s9UeG5xYsqO3th9AddXeBq2OieSfAM8evhI-PZ76-Buf7EcnCv0gKKLndR0YEV2kTxuAD_VKH6HEbZFGsVNkpiitjOp_daSiXpE3Pd_X3qe-bekUwRlgzVovAcCBt0z5yUU5xFBeE38vP8NN1cwM2zQW5_7-qCme8EqiiMFCG2Ay2jEuV-Mt6_R7CSZ_4Qpfyg72SYxiWyNTXgo6I5tXyWGQHQidH56yjx80w5W6MzM_rISju8-hWDgTKMLHvvBN_nvifftaqT2Ht2SwlTOoCX5AwPTOsvnOypW8Bt34JdJz5p8Q2j3cIzWki6NxB9_DJVSPxsXihbWaG1hNvJbp6fZFUEpLJ4Q5iY30Nm6loZZR27Nmf9kDofNetR7U_u2AVsBz63YMyyStHn1xUGwnv_3JE2SNvibSL1RFGSJT2J0_XlSzQPG3_MStb5SU1__5ByxR8V2GtHJB_U4ZhNIEzs9A9c=&p=2&fvj=1&vjs=3
Software Engineer,Complion,26 days ago,"Cleveland, OH 44115 (Downtown area)",no data, Complion recently won “Best Growth” and “Startup of the Year” and we’re looking for an up and coming Software Engineer to join our growing cross-functional team…,https://www.indeed.com/pagead/clk?mo=r&ad=-6NYlbfkN0C8fsZAUwot6QlMprF6kLU8IkgjbiU5mN9OqR1WV3Drrrq7INcsIBLuBUt8JeBO45Yknz7n6s-nogG6UnQiMrBzXq7ojDMkM1DaEFD3gfvvZDQkwe7wx2nT-8IVgu2hgx48BOA2gF326ZSZTSAVbsYO-0HJ1qp85pK9LHJRVthALWH-KCKiLAEszr1AoFa9gOv395EV02OUNugacP-CLx0GSRTsmchm1ot-3vBgJrQYXQjVhtsi9AuzBKQspG39CWf5fGTkzRe23JvR-0stNjjzzLtefh3HB6_M8aQfuZHaphmKkC1vneqkDNvRA8NZu1pwhiVblzyFEeILK3cOwI3cjZRqYxvYuw_1YdaZ7ZNRgeBjzZfQ8gsmgiFSZ9nYwUp3mcMcfdLNrSH1Qjs8H7vkpvBGZwOElthEs1wtLT2MJ7M9fJGIF9PU53JUSETqsyLXgehGbQubf2vsoxoXm9wU&p=3&fvj=1&vjs=3
Quality Assurance Engineer,Patriot Software,16 days ago,"Canton, OH",no data," Scripting languages for test automation e.g., Ruby, Java, Python.We are looking for a Quality Assurance Engineer to join our fast paced development team.",https://www.indeed.com/pagead/clk?mo=r&ad=-6NYlbfkN0BHedpvpXdEsaK4PWVik6d5d_gh7qP0dihMo_Ne_EB-Xj3H3RHAqMxAomrCTkelnw3wJ7l-FtkJMDoFcJdVWhvFlWpo8MWRKIst8zAWJbrPccAm3MjAnlRHbOxZmJ6rlZeWWeXHimqOQEAUBVEN5b0zKGwKviv7egBBRlRt2MmoCpSUKwARqDt8YYLUFg7wgcdIjenFgDPt2lOpGoKcRQyI6_MYGloXpvO3cRzUw93VfRzFTpxPlogBMj-oXjoXGKo2NzZ44AOREqbFPz-ykiGRHSMXcEO92hXq-pyXL9CPN3M1qKMSy0pnxg4WXfPGuchPgZIa80bLD_RHbps4DQmbA7RKJ8AZZdkZ10OU5cPCft1aw3XGvYjY7FvAHKpnOJwFCVLs6RwMSChDKhG0k1-9dHFvSgI2ixKcgXeCgwu3J1ilYxHA_5l0q7auJFeWZo1Z0gfxcAbBGoK7ExUYIul3tyTg5dwgVQVlU5x-poZFfv1ALSl00KutcQqnxYZVIU3oq58LjVk1OUlPvxI4ZlmjgLtSaoxiTAtZqhcMyPcWTDY2YoR4l6yv9i8XzQpXoN8-X3SzcSg90yp3NFeduzz6mi_uUyCLm7z3XfsVdokSUJs5XPLWzNiSOgh6IW-at9YURVVKTyLewT_0wnZUlPoEXlIl4UqTsoM=&p=4&fvj=0&vjs=3
Python/Django Developer,"Incyte Studios, LLC",9 days ago,United States,$50 - $60 an hour," Our most immediate need is for a full stack engineer with Django, Angular and Postgres experience.We are servicing a contract with a Fortune 100 energy company…",https://www.indeed.com/pagead/clk?mo=r&ad=-6NYlbfkN0DtQV-LeLldfQmgz-cqQl_HAZvaYDzY3V082QIM5xmnAYgPKQmoGnVNA6eA-_-ieXUqrX7SggKIolFQqzY-fIp1u0YOe5yBkdgdPWrHKdAPZs56GulV6Bh3xFHyzc-7lxkoJf2GhqerOsP_jXM7ftCyyIdkx10RU4QWxM5cmQ3ryXALAaDzs4bfJmsA7NPfc25CNOHMLAFtqE4wvMNYhjgoYhYWwIxhM8eGPsii-K-qVCMS2A7LDzd1k_oBRJ_oEpYShT0fZ8qV3HUrI15iCb4Q-kvOgzImX8dddCIHkodF0l3yVQHJL6T0Cd0H4KUX3vM8p9ivYdLKerorqPr2KII1ZY6LcBmn8rq40eDLvdwKnnrQXhZiQqkM6RP0lPjEly3azVkD4TeNY0SGiU5aZLu30_RvxrJsyjlr_QFlklLByNJcxQ0U0OZhDfgDO49ZG8fiulnA82jvZihwTo9mTgE5&p=5&fvj=1&vjs=3
Medical Image Analysis & Biomedical Software Development Eng...,Case Western Reserve University,24 days ago,"Cleveland, OH 44106 (University District area)",no data, The software development engineer will be the lead software developer and work closely with the principal investigator of federally awarded grants to develop…,https://www.indeed.com/rc/clk?jk=8ac06b2d1b578f46&fccid=ca618b34d397b8fc&vjs=3
Software Engineer,"Vertical Knowledge, LLC",30+ days ago,"Chagrin Falls, OH 44022",no data," Experience programming or scripting in Python is ideal, but if you know C#, Ruby or similar language and can quickly pick up Python that will work too.",https://www.indeed.com/rc/clk?jk=1183b59259fe9f64&fccid=68fe1ba5e9612434&vjs=3
Software Developer or Developer Senior,Federal Reserve Bank of Cleveland,30+ days ago,"Cleveland, OH 44114 (Downtown area)",no data," 5+ years of related work experience for Senior Software Developer.Working knowledge of development languages such as java, C#/.Net, or Python.",https://www.indeed.com/rc/clk?jk=54bfe125875ba748&fccid=76541fea22596adb&vjs=3
Senior Industrial Applications Developer,Sherwin-Williams,3 days ago,"Cleveland, OH",no data, The developer will create new and maintain existing SWBatch applications and work closely with the Watson team to provide Historian links to these SCADA systems…,https://www.indeed.com/rc/clk?jk=ec5ef6aaf2aa7655&fccid=94f8a3a6ac5079e2&vjs=3
Software Engineer I,"ZIN Technologies, Inc.",22 days ago,"Cleveland, OH 44130",no data, Completed related tasks within Python with multithreading support.Bachelor’s Degree in Software Engineering or similar discipline.Are you a US Citizen?,"https://www.indeed.com/company/ZIN-Technologies,-Inc./jobs/Software-Engineer-05976c639fa409b0?fccid=5c16398b13e23042&vjs=3"
Jr. Data Engineer,ExactCare Pharmacy,9 days ago,"Valley View, OH 44125",no data," Experience in Python, SQL, and the MS Azure ecosystem.Data Engineer, an essential part of the Analytics Center of Excellence, reporting directly to the Vice…",https://www.indeed.com/rc/clk?jk=6b3695c76df7922d&fccid=7d1466639cc4bfa1&vjs=3
Senior DevOps Web Engineer,Sherwin-Williams,3 days ago,"Cleveland, OH",no data," 2+ years of experience with automation and orchestration tools such as Puppet, Chef, Ansible, Ruby, Python or Shell scripting.",https://www.indeed.com/rc/clk?jk=8a1d5183188727ed&fccid=94f8a3a6ac5079e2&vjs=3
Associate Software Engineer,AXS Group,30+ days ago,"Cleveland, OH",no data," As an Associate Software Engineer at AXS, you will be building and supporting the next generation of fan life-cycle management services for the sports and…",https://www.indeed.com/rc/clk?jk=f36af79bd9a70a88&fccid=250bb64b2916d169&vjs=3
Business Intelligence Developer II,METROHEALTH SOUTH CAMPUS,30+ days ago,"Cleveland, OH",no data, It also provides health care at more than 40 additional sites in Cuyahoga County through community partnerships such as the School Health Program.,https://www.indeed.com/rc/clk?jk=92665a7a4b3bb8be&fccid=14c7574fca6ec22a&vjs=3
