Title,Company,Date,Location,Salary,Summary,LinkSoftware Engineer,CO-AX Technology Inc.: Electronic Manufacturing Co...,30+ days ago,"Solon, OH",no data, Develop Python based PC User Interface software.5+ years of professional software development -- preferably in either Python and/or C (candidates with similar…,https://www.indeed.com/company/Co--Ax-Technology/jobs/Software-Engineer-14c8c7118ddb1cab?fccid=f0b108acf12be120&vjs=3
Back End Software Engineer,LeafFilter Gutter Protection,5 days ago,"Hudson, OH 44236",no data," Enhance DevOps practices and developer tooling.Write/extend web applications (Node.js, Python, PHP, C#) using frameworks like Express/Vue.js/Flask/Django…",https://www.indeed.com/pagead/clk?mo=r&ad=-6NYlbfkN0CN4HTjSpg-URDVZANUOzLoPqX2aI5Mvt-Jtbs12J84vVM3iprtXOwptmWfEiCtzqIpeHxNS7b2rjXzoHLdM8o5vrjhoxe7_dtcc-Gl3fx_aVdA6a3uGZ8Mj_LpF24KujoxWsJa7f8sPPqBBOxl1_nd4rTmoGlZTpwOlU7GOTliP53SivB5friexJ4arwvHUAqdvT2-pzd4PvWhcAn8aogxRclEhNVNqKls1N2bEXRSxADkf4lqmM6FgeSsVbFCk5ymp78OheOwfdGfgX2EqQU_rCbwIhIT-L1goLX95caz5a50YpHqOU5s7G3q9Nu6mkrhizVR_b9NdfYBiQNywmjMDbbT9AIoDV14CjqAn28NB9E5vOR2kMfwbACGUgMYhikO7KG9tt5pc79YrXDFZMMydz27Evqlv4XAm1MryF5ocd7_9sLRT9LqlDq5d3v-TX1PlZHMHeVGQJLhLfan9VVw2HrY3T2AgU-vOrE75f6-nrylBIo4AehHpSgbzMxcSbU1zjCTBkAq2Jq6l5Mjtba-0pZ8qzcMJaox1LBTs0T4TjeMyrp8I64wV_KM3hqo8oXw33-u8cKuhcPU8PtdOfjjSCMtJkVW8QHc7RTeCwA3ocw_oYJAL-5hTxWQAR1mcUM=&p=16&fvj=0&vjs=3
DevOps Engineer,Patriot Software,22 days ago,"Canton, OH",no data," Experience programming in Bash, Power Shell, Python, PHP, Go, C#.You will be part of a talented team of engineers that demonstrate superb technical competency,…",https://www.indeed.com/pagead/clk?mo=r&ad=-6NYlbfkN0BHedpvpXdEsaK4PWVik6d5d_gh7qP0dihMo_Ne_EB-Xj3H3RHAqMxAomrCTkelnw26ZdexNurz9rh1pHgZr2AR_r0L0HxzIibjzza9Uj2DtdNA-8YJcYxxa7qDhzhSbod2e3r3Xdjq1l-8NEZS23NetET9R_0oAl-wLqTE4tabFHCOWjCA4GIn9971g7C2Si9TLxzyU7gztTPhFEJ3jkuVLiCYyQvO6x_sxDk0nHu4JKslL5O3ot1wPFU_fMxcN9kor9FZg0QF6eMIBA1ArsrqHInSZpLZ80QWLUKPiXvfIk3hwAqdDEBC5gY0_P5bL2H3XOmCHNrh2bzfVol1u6-Jg0nkCB-jK-tqkwuVRAIBif0Hmk5LDG2N6xEMZ4Emp0Rv_IUmrNpl2ptLts805Bzkwrcko7UJk5woxSlwpOM4WiXhoziYp5kUyci4XeE_8TnHHfXoZ-DjoEL_EHr1DOBX1WSVjOAp438nw0qVD_yN4nJfqw1HV5oNtZFJEXYewIuW3hpsMp3Ee1Zs10MI0L3kSlIaJwgA4noMtXV2GuREwMl4ySi9xrdicaYt8MKbxt9s2ItvS41vZpoH8vDOmIPYLZE0swiKKOUTnxkIx1F0oNDeBRDkmr5KQLYglvD2rv0InFhg7CO74AZD0vGAu_ke4PCU0C2U1fI=&p=17&fvj=0&vjs=3
D365 AX Developer,Agility Business Solutions,30+ days ago,"Cleveland, OH",no data," HTML5, CSS, JavaScript, ASP, Python, XML and SQL skills are a plus, as is familiarity with Microsoft Visual Studio development tools.",https://www.indeed.com/pagead/clk?mo=r&ad=-6NYlbfkN0Bx1fXn6alTMpFeDNCF4CS42N3f1cgysk8lkLxcSpX4r2tjKoEiTmILkqOeTpt8w6M9xPUEsPPWrwtHl7Jg2l6-UGik6s7fVaCVVXxQ0YRWcY_UB8gB-k5HDLL5rXceEPhIN2hSF1525NWnZGngTWbtuvtJsBjNDpoDhIXXGOt0Anjc2b79PKbz_jpobIbjaRLYMePJIJCA6k7JN1jFnNa0-M5hVT9qM8Fwuteylivb3bATdlvBZ2YdvvOi2_AxQXIp0_zfdLrbaJfcnUZtravtJQVv4pxnHGDJCc-BoiSQBPY7nwXOMSCc1Z1WRToq8ZeiLYVw3mFviu5WCxDOtCzgtY37y-sXOYu_2_bocYrxfDqppSdIDzNyekqQsfeYb4VfFdwXxClaIuraj7kCC5Q0yYNTnANvF2ChHvVV1W-h1IfIfmVorUf7xXH91_ne0WwIiIuOh3sHVg5izW1awtiuSrp8vrCmwq0=&p=18&fvj=1&vjs=3
Sr Application Software Engineer,The Timken Company,30+ days ago,"North Canton, OH 44720",no data," Familiarity with common protocols and languages (http, ftp, HTML, XML, JSON, MATLAB, LabVIEW, Python, Javascript, R, etc.).",https://www.indeed.com/pagead/clk?mo=r&ad=-6NYlbfkN0Cx0OrPzCAuK2R1MRT2pFqDWoS6NgHx-402lOBEwKTcTgTVbEJapIPsymrlMZCMmAiQdJLjQgDtCteLJBbTmsLidOOShXjAHYwlAvvqTWg1pSCDyDI2_qt2FN-sNx8pxRG8mC0U2nvDQtb1DaRGEqsNV1UGUlZ8yi4I0xV9TnmJjthk_qkD7IK0YROtZUxvMKnswtJW7bzs_uGqtTDTVyn2KwOLtx1TkO7xFkvUpdZ-8rb0JezmSQCrf7BHqr_cLLWDZo5XMyMk7zz3gSEXi9uSX4OpiKA2s0Fcy7Ogil5gUJKEfTWMhSuPeoz_r-zK5cJcVDalR3ALxv2t71_Dh_Fl4FnZzOU-J5dPmRsXoApORfDE1z2sYz6nMxnhvsuUScfwxLjWuBdtoDgURyxx7jFn2vLUJ_WJpe1SeIdyq8OnmrtFzgYCpQrMGIgit2EcrHfZDJwwPGZvHC9XgwMpDfV0aSACsZnPPEG0rSI-UrtlPU8Xo7OJzgHvenKNIg3NKy0rWwuTVDBGTOVfmtBO6HBbo3hss7ZgntPXx3j_aR3dG-Hcoew5VBxlObdxIyFzZStbjoP7ofdaSA==&p=0&fvj=0&vjs=3
DevOps Engineer,Patriot Software,22 days ago,"Canton, OH",no data," Experience programming in Bash, Power Shell, Python, PHP, Go, C#.You will be part of a talented team of engineers that demonstrate superb technical competency,…",https://www.indeed.com/pagead/clk?mo=r&ad=-6NYlbfkN0BHedpvpXdEsaK4PWVik6d5d_gh7qP0dihMo_Ne_EB-Xj3H3RHAqMxAomrCTkelnw26ZdexNurz9rh1pHgZr2AR_r0L0HxzIibjzza9Uj2DtdNA-8YJcYxxa7qDhzhSbod2e3r3Xdjq1l-8NEZS23NetET9R_0oAl-wLqTE4tabFNad4VKI0lagPqcn9yz2L7DvYqq1TKRb7htUwLfzoqiVERC5WP9FHfhnSbCpWnxOrl3GORReYVJ-M8K9lDfbd4KiNgYSkNAPJVyH_Oj7lvO8XfBd16ZiNdQkmfCY0qeWdXp4FrSSVjxy559uzWPU4U-7tQ9KhrccNmbN7XhoyTy4FQhfxCf9iamaj0fWm-QIYk1QqVwo1w5PokoLycxMHQc414Ph6sJwxycKsuKjjA53pSlvopRfaFJGjRvaG-JnVqDDPNAY2ws7azl5vjeL04Mi0Cl-HMEs5cWK5u1El-AiNJn7QK5A85cq6wcTNrNx_3fifQ4q9BH8dl-F4b688bzVhBnfX2te_1qdCvn1EgqzIAobBoog0R2MsEyw4NOn7MJMDV69YfuhNgsN5MfOS0epRVIDka3Aq5KE5EYaZ7gw9ODPgsmV7I0FF-oZOdw2M-Mzv9vZI_z_10sPGeW0FDN5DuK_gmkui04ZfGVd7yQ6ZHKkeWQshpQ=&p=1&fvj=0&vjs=3
Entry Level - Software Developer,Smoothstack,25 days ago,United States,"$55,000 a year"," Net, Python or similar programming languages.New college graduates are welcome to apply.We have multiple openings in and around Washington D.C. (Metro area)…",https://www.indeed.com/pagead/clk?mo=r&ad=-6NYlbfkN0ChdE_-3s9UeG5xYsqO3th9AddXeBq2OieSfAM8evhI-PZ76-Buf7EcnCv0gKKLndR0YEV2kTxuAD_VKH6HEbZFGsVNkpiitjOp_daSiXpE3Pd_X3qe-bekUwRlgzVovAcCBt0z5yUU5xFBeE38vP8NN1cwM2zQW5_7-qCme8EqiiMFCG2Ay2jECghB359HCGNFC6pb2hHid8upozOHrwjHY9D6jlBzfvAOEfkU49-2QdXcqLYHedLI8ed0XIiNJ93z69xKOPxxzccqmZlt9lUtvXhNtz6R0lFn4szF_K0o7t-deh3GNWmkNDE_eYDMr2-KGiQfRWx1mpuejn_JK5JCW4Pq_3J4HN7O3IdhlGX8KCIWgrIAsiLNoEARmezkfYbnBfMoUCk_EYEUe2h9-Iu51m04YI1a-C22lOJV1-mHoC6QWIG_HHi1duZkAcWmAbFATaP69e2GUoXqaRotIur5c0beHOzQGeg=&p=2&fvj=1&vjs=3
Software Engineer,Complion,26 days ago,"Cleveland, OH 44115 (Downtown area)",no data, Our cloud-based software stores critical clinical trial documentation for hospitals and medical centers to ensure the delivery of new treatments to patients.,https://www.indeed.com/pagead/clk?mo=r&ad=-6NYlbfkN0C8fsZAUwot6QlMprF6kLU8IkgjbiU5mN9OqR1WV3Drrrq7INcsIBLuBUt8JeBO45Yknz7n6s-nogG6UnQiMrBzXq7ojDMkM1DaEFD3gfvvZDQkwe7wx2nT-8IVgu2hgx48BOA2gF326ZSZTSAVbsYO-0HJ1qp85pK9LHJRVthALWH-KCKiLAEsvjP7S06DvI5KkBcsVehLVFx6FQCEZX6mIx8t5SQd1tOKBeHINwxVorymZ3ZEt6yZbrtBaa6ujpb0gqpaO5C7UvdNAV9MNpm85pbJs3s1pEqaP85IXczogEi6kk2j_68lnSnbM6SurLIiuBWBj9Gh675QHkInVQjEPwjCKS0_t6tQs8XyeRYYuUAC9TYq2fQwoQFOnuFV51uzenl5u3V_9Rt-oMzUG9mxXVzymDfw9yGEPyOsab2GzZyFRg5mE9mxXNSnvP0ZbDviZFUuqCd_dXPdataQ01Xw&p=3&fvj=1&vjs=3
Quality Assurance Engineer,Patriot Software,16 days ago,"Canton, OH",no data," Scripting languages for test automation e.g., Ruby, Java, Python.We are looking for a Quality Assurance Engineer to join our fast paced development team.",https://www.indeed.com/pagead/clk?mo=r&ad=-6NYlbfkN0BHedpvpXdEsaK4PWVik6d5d_gh7qP0dihMo_Ne_EB-Xj3H3RHAqMxAomrCTkelnw3wJ7l-FtkJMDoFcJdVWhvFlWpo8MWRKIst8zAWJbrPccAm3MjAnlRHbOxZmJ6rlZeWWeXHimqOQEAUBVEN5b0zKGwKviv7egBBRlRt2MmoCke6fN0hqIq7Fh7BxkMFYxbzhPLuWWPFDBJUPa7WSN-ReBA0JMpsQq4H1IGzij5sgMMMuZBdJNuIvgO7ZfzIBDKZ6clFuBvFZnyGqQStMIS-0nLSnyQbeUYvGTruP5j5vdo5S7OOrxn3byxmoY1z3lRrMqSnEsU8F_PFEpfb8eMxI5-FP5PjL_sREcm-vORPTPcKVgXm78w22dESXQ_LzzGftDEv_9L1fQyf4feftHmKsG-O9zV9IfAEz1TEciP1yXCKUvbA4kAuL0tDNlw4VdRFBnRHelK3Qp5EQLvxdvGc9GVmrB5FHSvKYaQ4amtjbdXlp7v4iatFq4DoiOtxbx8BXVzpEFmL5uUysZZD1AWlnnndw2wMI0uL8y6CbLkro42qXlE5omm8OUMEggWmawQf9ibmzIYvdNVJlG4UhO438Tdli-BqCvA_0iFudJd3VeItbzPDyzci-_6QQ6N3qcpLXMkpR1zHDgLppb5POaSUFTJevWYM8iM=&p=4&fvj=0&vjs=3
Python/Django Developer,"Incyte Studios, LLC",9 days ago,United States,$50 - $60 an hour," Incyte Studios, LLC is a software development agency specializing in the Energy Sector.Our most immediate need is for a full stack engineer with Django,…",https://www.indeed.com/pagead/clk?mo=r&ad=-6NYlbfkN0DtQV-LeLldfQmgz-cqQl_HAZvaYDzY3V082QIM5xmnAYgPKQmoGnVNA6eA-_-ieXUqrX7SggKIolFQqzY-fIp1u0YOe5yBkdgdPWrHKdAPZs56GulV6Bh3xFHyzc-7lxkoJf2GhqerOsP_jXM7ftCyyIdkx10RU4QWxM5cmQ3ryXALAaDzs4bftB0RSaw_SvD18_3aRqQGGmS7HqRJkQ6aiDKGAilnwkVCujklv4OCyom6b5QA6JPvkMP-SGiE2Fjf3z--j8Z4ntVzeXuO1uV8qumea19gM1d2zgiwehaCsanyNfWm6J_Az6lCrzr7FdPDmqN6MqP7lPMbkKwtHkeGJBHsWUpWJsix30SzQO9IxH5QuMv4BliLCuqttxEhcx9vv3Aaz9YhsCWOM3Gea7TdSlAUcPvuP_eHt4Ll4EWg-b45WdSmuLVD8mIQ9N9_jzR3hKQ1QQMEwjR7-NRxvGA3&p=5&fvj=1&vjs=3
IT Cloud Platform Engineer,Goodyear,30+ days ago,"Akron, OH",no data," Experience with an AWS supported programming language, preferably Python.This Cloud Engineer role will support Global Technology’s Innovation Beyond Tires…",https://www.indeed.com/rc/clk?jk=c53da3fc01beabe0&fccid=e451672f561ffb08&vjs=3
Equidox Software Developer,Onix Networking Corp,30+ days ago,"Lakewood, OH 44107",no data," Software Developer - Product Development (Equidox) - Onix HQ Lakewood, Ohio.Ability to develop in Python and at least one other high-level programming language…",https://www.indeed.com/rc/clk?jk=f09754b4e08f9ada&fccid=cdf5f442bc9a18df&vjs=3
Software Engineer (MR),"CANON MEDICAL RESEARCH USA, INC",30+ days ago,"Cleveland, OH",no data," Design, develop, and productize machine learning algorithms for the improvement of MR image quality.Work on multi-disciplinary teams to translate customer…",https://www.indeed.com/rc/clk?jk=a452c65b8282d00f&fccid=5d8873603f1d5659&vjs=3
Competitive Intelligence Engineer - Software Products,Rockwell Automation,30+ days ago,"Mayfield Heights, OH 44124",no data," Should be familiar with C/C++, Visual Basic, Python, Object Oriented Programming, other modern programming tools & methodologies.",https://www.indeed.com/rc/clk?jk=e6cb79d79f5b85fa&fccid=a4b7e90c6a891db3&vjs=3
Software Developer or Developer Senior,Federal Reserve Bank of Cleveland,30+ days ago,"Cleveland, OH 44114 (Downtown area)",no data, Software Developer or Developer Senior-260950.Coach and mentor programming staff (Senior Developer).3 years of related work experience for Software Developer.,https://www.indeed.com/rc/clk?jk=54bfe125875ba748&fccid=76541fea22596adb&vjs=3
"Industry X.0 - IoT Edge Developer - Consultant in West, Midw...",Accenture,5 days ago,"Cleveland, OH",no data," Industry X.0 IoT Edge Developer - Consultant.At least 3 years as a software engineer with experience on one or more of the following: C++, Python, JavaScript,…",https://www.indeed.com/rc/clk?jk=1ddeed9798d4b105&fccid=a4e4e2eaf26690c9&vjs=3
Cloud Developer,Integrated Modern Engineering,30+ days ago,"Cleveland, OH",no data," IME is seeking Cloud Developer to create innovative public, private, and hybrid cloud solutions for Amazon Web Services and C2S customer environments.",https://www.indeed.com/rc/clk?jk=f43aa7567f2bd8f9&fccid=eadc3dd3ce4c9a64&vjs=3
Site Reliability Engineer (Development),"OverDrive, Inc.",8 days ago,"Cleveland, OH 44125",no data," Experience in use of scripting language to automate tasks (e.g. Ruby or Python).The Site Reliability Engineer's (SRE) responsibilities include availability,…",https://www.indeed.com/rc/clk?jk=78a41a4693c15a97&fccid=791de2a80d23b0f1&vjs=3
Web Application Developer and Analyst,Arconic,30+ days ago,"Cleveland, OH 44125",no data," Familiarity with Azure DevOps, Python, Bootstrap, MVC Architecture.Arconic Engineered Structures (AES) is seeking qualified individuals to join its Continuous…",https://www.indeed.com/rc/clk?jk=7f46f7b261012322&fccid=d6da256b9372422a&vjs=3
Back End Software Engineer,LeafFilter Gutter Protection,5 days ago,"Hudson, OH 44236",no data," Enhance DevOps practices and developer tooling.Write/extend web applications (Node.js, Python, PHP, C#) using frameworks like Express/Vue.js/Flask/Django…",https://www.indeed.com/pagead/clk?mo=r&ad=-6NYlbfkN0CN4HTjSpg-URDVZANUOzLoPqX2aI5Mvt-Jtbs12J84vVM3iprtXOwptmWfEiCtzqIpeHxNS7b2rjXzoHLdM8o5vrjhoxe7_dtcc-Gl3fx_aVdA6a3uGZ8Mj_LpF24KujoxWsJa7f8sPPqBBOxl1_nd4rTmoGlZTpwOlU7GOTliP53SivB5friexJ4arwvHUAqdvT2-pzd4PvWhcAn8aogx3i0SwIYAo7CJwRxY6ZFs6bO8oFaUr2NgtpBQ_Cs1TPNzIMJN0wiYYLngc4384D7VG0QehFay5Rxxzn4yvLovsMfhIOwIuHWs_knBYMPBjnoe86HEUsUK4wleO4dABK6mASeS-5qY-0ru5_f4ZS09h4nmsgg59IqVU2tvAbeqvr3zcGO2YhhGCLfjl2lS3TnATv1oL99S1SyaWVTMPmEJyzCHHXbzHVen45Q6GgPoeMORb7f_iH2EKdThLTP5fuTIZwbj32QkPNsq_e8dBUi6dSrQKNrSt0nfUCgjc6zn3eq7yvRa_tQT7zW_Zib8MTyh_mRbwq0dB4ZqEOUmPPU-adx-NeXkxiAANRq6-uIjaABDsBd2HxsVIOwe3tHa-jGGova9_z-OvBp9sECo76HuGFjMVYoXD2RTiZzSxORpB7A=&p=15&fvj=0&vjs=3
Java Developer (Entry Level),www.advantecs.com,4 days ago,United States,"$55,000 - $65,000 a year", Shortlisted candidates will have initial interview with the Employer t and selected candidates will be on-boarded into a Corporate paid internship upskilling…,https://www.indeed.com/pagead/clk?mo=r&ad=-6NYlbfkN0DIjBdOhcvN-vt2b7UpMuy1LIBG3msLj6vp7TuM2Ezbx0WFT323hYkzSzzDgW0oVmEPfOXyFIXIVGJJ7Lyoy5L7iPSGf_Y4T3hkXmUnDaYuNWjthhu83GA4a3H6bP5CPQ_23rw9pB2lN6gMP2Z3sbw3n05nT66iLHIrgcO6nvG5X54RlW0SP5gNETBoIwxd22mqXa1NIRnOMZVTBkhaKu0ZfbFkSQ5dZFMKOeX7dJE7kkIUelZ033MEahsUHr9GVpitGuqoGwftFgbjatZ7YoXpSkkexq4Bdx64S0i6bzsWW5siqv2h1psQIUmEbCkq2q7gPkzunBT4I_WC773itoQoWpcr5q8KhXpC0WQ7iSOsbzb763QhCr6Tzp_jtTO8Zxc71N9WQPL3uO055VoxawC0pt_5fhJhZqR2jUcvx8e1alTL2f_7ToDw5R_hARJQ80iVeTgt5Ran53NWh-nSTWHzkMwQv0SgEj8=&p=16&fvj=1&vjs=3
D365 AX Developer,Agility Business Solutions,30+ days ago,"Cleveland, OH",no data," Job Title: Developer, Microsoft Dynamics 365/AX.What you’ll do as a Developer:HTML5, CSS, JavaScript, ASP, Python, XML and SQL skills are a plus, as is…",https://www.indeed.com/pagead/clk?mo=r&ad=-6NYlbfkN0Bx1fXn6alTMpFeDNCF4CS42N3f1cgysk8lkLxcSpX4r2tjKoEiTmILkqOeTpt8w6M9xPUEsPPWrwtHl7Jg2l6-UGik6s7fVaCVVXxQ0YRWcY_UB8gB-k5HDLL5rXceEPhIN2hSF1525NWnZGngTWbtuvtJsBjNDpoDhIXXGOt0Anjc2b79PKbz0xi4dwbaAZpwStBfhma0Hu4Jl2c8tZ95sT-xIQxv5Wz-UUrGXvSVzniO7-wJ4HOfRdepGVkcVCb5qzJPUjd4hVk28vFm698pzt4DUeZgPY-KKmoGbkzXMv_TBRQfBzcHVVaqamlJgBGNspOdxhjDneAyutWY0yjKXD6w2nIwFmopqa7kBd-IjHhisAlTVsbKxFbgl1jwkbeBOES4mgUKPdn-RJ51Fo0rQcx2g5cYTAewJrg6H0qLz5VwrJe5C0sWrDR0xegUVzSM4zkmCgPH7XRJHo6XpMaPh4nFda6oJJA=&p=17&fvj=1&vjs=3
Cloud Developer,Integrated Modern Engineering,30+ days ago,"Cleveland, OH",no data," IME is seeking Cloud Developer to create innovative public, private, and hybrid cloud solutions for Amazon Web Services and C2S customer environments.",https://www.indeed.com/rc/clk?jk=f43aa7567f2bd8f9&fccid=eadc3dd3ce4c9a64&vjs=3
"Artificial Intelligence, Consultant - Applied Artificial Int...",Deloitte,30+ days ago,"Cleveland, OH 44114 (Downtown area)",no data, Experience with scripting languages (JavaScript (Node.js) / Python).We are looking to add a Developer to our team.2+ years of relevant work experience.,https://www.indeed.com/rc/clk?jk=27697f963c3d70a0&fccid=9e215d88a6b33622&vjs=3
Data Analyst to Senior,Progressive,30+ days ago,"Mayfield Village, OH",no data," Object Oriented Programming (Visual Basic, VBA, Java, Python) Training, Course Work, or Experience.Learn and leverage BI Developer Tools such as Microsoft SQL…",https://www.indeed.com/rc/clk?jk=bd4d0e090443ceda&fccid=082e59b71e3e4fe2&vjs=3
Technical Writer,BrightEdge,30+ days ago,"Cleveland, OH",no data," Experience with SEO, LMS (Litmos), MySQL, and Python are a plus.As BrightEdge’s Technical Writer, you will report into R&D and collaborate with Product,…",https://www.indeed.com/rc/clk?jk=e3c544b4b2d68fca&fccid=332d3b482e84a815&vjs=3
Production IT Programmer Analyst II,Giesecke & Devrient,30+ days ago,"Twinsburg, OH",no data," Understanding of scripts and batch processing using tools such as Python.3+ years of prior work experience developing, implementing, and maintaining software…",https://www.indeed.com/rc/clk?jk=1a7409f52f27ae8c&fccid=063d96b934033d66&vjs=3
Software Engineering Manager,BrightEdge,30+ days ago,"Cleveland, OH",no data," Participate in the design and facilitate the development of key back-end components in Python, Java, and other relevant languages.",https://www.indeed.com/rc/clk?jk=869f441628995214&fccid=332d3b482e84a815&vjs=3
Software Engineer (MR),"CANON MEDICAL RESEARCH USA, INC",30+ days ago,"Cleveland, OH",no data," Canon Medical Research USA, Inc.(CMRU) is a multi-modality R&D organization creating next-generation medical imaging systems.Or 3+ years related experience.",https://www.indeed.com/rc/clk?jk=a452c65b8282d00f&fccid=5d8873603f1d5659&vjs=3
Software Developer Senior / Lead,Progressive,30+ days ago,"Mayfield Heights, OH",no data," You’ll develop web applications in public & private cloud platforms such as AWS, and Azure using popular languages and framework/libraries such as Node.JS,…",https://www.indeed.com/rc/clk?jk=b30e27e010d5560a&fccid=082e59b71e3e4fe2&vjs=3
Sr. Data Engineer,ExactCare Pharmacy,9 days ago,"Valley View, OH 44125",no data," Extensive experience in Python, SQL, and the MS Azure ecosystem.One important function for this position is to build optimized data flow pipelines to automate…",https://www.indeed.com/rc/clk?jk=6cddfff96d445d06&fccid=7d1466639cc4bfa1&vjs=3
"Engineer 1-3, Controls Vehicle (Driver Assistance)",Knorr-Bremse North America,16 days ago,"Elyria, OH",no data," Familiar with CANalyzer, CANape, CANoe, Matlab, Simulink, dSpace, Python, and TruckSim.Engineer 1-3, Controls Vehicle (Driver Assistance).",https://www.indeed.com/rc/clk?jk=dace7350cd46dcae&fccid=0fb80adf3d7b68d9&vjs=3
Back End Software Engineer,LeafFilter Gutter Protection,5 days ago,"Hudson, OH 44236",no data," Enhance DevOps practices and developer tooling.Write/extend web applications (Node.js, Python, PHP, C#) using frameworks like Express/Vue.js/Flask/Django…",https://www.indeed.com/pagead/clk?mo=r&ad=-6NYlbfkN0CN4HTjSpg-URDVZANUOzLoPqX2aI5Mvt-Jtbs12J84vVM3iprtXOwptmWfEiCtzqIpeHxNS7b2rjXzoHLdM8o5vrjhoxe7_dtcc-Gl3fx_aVdA6a3uGZ8Mj_LpF24KujoxWsJa7f8sPPqBBOxl1_nd4rTmoGlZTpwOlU7GOTliP53SivB5friexJ4arwvHUAqdvT2-pzd4PvWhcAn8aogxQ5XyC7JwcLbWIHhkZoaN7WT8g04zS96W2p-ECdVjkiz5wj_-NvOxwE3ijxXH9uGNLCRwmaA9POvRL8x_zUIEGZ3BoEGG4p_fAvn6wEpTjb_A_smLemvxcKanwOx6xb1-PK795VFNlzYorWCEEHqcwkQw9swxrcvFkxVASLXFOPzYGy2tbKKatYqv6hDXD04KOkXgk2BSI1WXySwyotGUDzihgsRzbZf2y2QIsNpZUrJR7SshuL1o_OlQ0ebrkjNHyal3zQgnERE39b25-GfmmewaneOkzPAs1DOoVF1lVRBOcGy7uSuF5ClT-7wvcp5UmeLfDbXUyc4fN5bab5dF7mshLpJGbbsnZEeTkvAekpX3oCmT3Ws3c6cYSpMRZqkILlSR8vAhnAu5uWBS58c5jVjx6vGk5cYEFsa7yFutGf0=&p=10&fvj=0&vjs=3
DevOps Engineer,Patriot Software,22 days ago,"Canton, OH",no data," Experience programming in Bash, Power Shell, Python, PHP, Go, C#.You will be part of a talented team of engineers that demonstrate superb technical competency,…",https://www.indeed.com/pagead/clk?mo=r&ad=-6NYlbfkN0BHedpvpXdEsaK4PWVik6d5d_gh7qP0dihMo_Ne_EB-Xj3H3RHAqMxAomrCTkelnw26ZdexNurz9rh1pHgZr2AR_r0L0HxzIibjzza9Uj2DtdNA-8YJcYxxa7qDhzhSbod2e3r3Xdjq1l-8NEZS23NetET9R_0oAl-wLqTE4tabFB4baW_0XmwXGlu_LJ8AoKUzlC3e8GT7fYG4AWj2H40tUZnB2T3ZpwWSqUxekhIcBBpj8LByq1Ex7ynyUygB2GgT8vGLfU4NqQCVOTEfZF0t000c6ZRicXX4C9nVS1tGBrZ_2jRu3tA62n72DBnAbWDU_iTZIPGqHVRs879ZdSoOYMdE7A7ZBZR2RjFnL7O3OdKC1YwWRlSiKvkEuawz157l9Q8QBOzD-lfj1TeB467mCrRQdzW15Qge6pu-2jwNIl9Df_kmSbhugk1rEGWM6el0fqvBFUKpmXSdMyO4AuffGXHbhpwUJ_pFgF9W3yB5zBpUwk0se7c9AiEjYG3AbxFxcZyE-BbkOqL9dNtaowQ2IyuGQklHf17smUPTOSWtDTyE55S_dcvL44K24QcwWBiyAsao7yYzCTqW8iBiOBrpE-SiHNTwX23_nimRVIuB_I6Y5KCg2Ma1jCXmqLvOjO9iyLPrTQvABafCGIhHLHDMpD31VW-0_FU=&p=11&fvj=0&vjs=3
Quality Assurance Engineer,Patriot Software,16 days ago,"Canton, OH",no data," Scripting languages for test automation e.g., Ruby, Java, Python.We are looking for a Quality Assurance Engineer to join our fast paced development team.",https://www.indeed.com/pagead/clk?mo=r&ad=-6NYlbfkN0BHedpvpXdEsaK4PWVik6d5d_gh7qP0dihMo_Ne_EB-Xj3H3RHAqMxAomrCTkelnw3wJ7l-FtkJMDoFcJdVWhvFlWpo8MWRKIst8zAWJbrPccAm3MjAnlRHbOxZmJ6rlZeWWeXHimqOQEAUBVEN5b0zKGwKviv7egBBRlRt2MmoCng1GZpKe6MKDaRSUyR3qOZa1qyv2ZtSrp8GEvNo64Y31GK6nRp2agMe81JCK1Go_bhv_igtYQfkPko6D-1d8-H6lnpRQk0XOLLlT88him0P5zYkKce1Jn1_u12TbcVvnFSvbJehjxNWF7BzZWdy5H2_wJL3ZYrej8jOxjizXjZeAK976OVG9bv5-FKM9DDjZ2Mk4jbE0aAhQIgrlhim0xv9-KhbHdjDni08waQeXzSqHTRmnECcvsIqMebbkMs0tNUcXc9GTjDVVoMyKv2zjjuyrzWmh5Wu20xxh96zFtsGUjoJ6FXCP1qsoOfMp46D8b6piKU9MIby4SZuJyY5hvsUAZjzUBXAK6bJOubRv7pZgbsdWbsG0eTA22VZBNFHQDXR16CL3H329sGAq6Oyh_lsWnFplPXqivWahkEhtJ8d0tvdcH3KGEA7VY-ThHZpSndrDWbtP82jaKOHrBwAffDEIWGyzJm3ZMmbNaCh3v-HdTb9FcSu_V4=&p=12&fvj=0&vjs=3
Python/Django Developer,"Incyte Studios, LLC",9 days ago,United States,$50 - $60 an hour," Incyte Studios, LLC is a software development agency specializing in the Energy Sector.Our most immediate need is for a full stack engineer with Django,…",https://www.indeed.com/pagead/clk?mo=r&ad=-6NYlbfkN0DtQV-LeLldfQmgz-cqQl_HAZvaYDzY3V082QIM5xmnAYgPKQmoGnVNA6eA-_-ieXUqrX7SggKIolFQqzY-fIp1u0YOe5yBkdgdPWrHKdAPZs56GulV6Bh3xFHyzc-7lxkoJf2GhqerOsP_jXM7ftCyyIdkx10RU4QWxM5cmQ3ryXALAaDzs4bfNKhMrfQEAxC9x3TZ7XS-2ugdwubpKqlPCrNQi6PEc13d1NbDc1Q3Cu-Vp1i1ZJo28tBbmW-k-lcKKpBkQfxcZZdHNZFrtUELeg26JRab7gov9BZaQYF3v2WMAf83HUFTRlHhhbrrRev4x_gnr_VWdVRiKm_ThfUxBxYFNrZhGNX4Mamp4Ivnbn3ctYCAEtQPimc8QWMFve3yAvfcQ7c-g-saukD5nmbB9r18D5KZs777UsQYUG_0xZgTlR8pLKqARyY9-p3bC7FYdyS61wd2Z5OAd1bBZM5O&p=13&fvj=1&vjs=3
Sr Application Software Engineer,The Timken Company,30+ days ago,"North Canton, OH 44720",no data," Familiarity with common protocols and languages (http, ftp, HTML, XML, JSON, MATLAB, LabVIEW, Python, Javascript, R, etc.).",https://www.indeed.com/pagead/clk?mo=r&ad=-6NYlbfkN0Cx0OrPzCAuK2R1MRT2pFqDWoS6NgHx-402lOBEwKTcTgTVbEJapIPsymrlMZCMmAiQdJLjQgDtCteLJBbTmsLidOOShXjAHYwlAvvqTWg1pSCDyDI2_qt2FN-sNx8pxRG8mC0U2nvDQtb1DaRGEqsNV1UGUlZ8yi4I0xV9TnmJjo6OuDWZR1Bul5RDrswFqwQCKWp7_oWBUQGQx1fV2batqq9qyodTdU5QfvyPKWpqWhtzoRBLkOcdyfJJHWwvz1CCxR7m6HPWu2RrFV_JGsgvOpLfRnKSg38fmsROHEGlbwCopou67ofkLCFdjql1OQlo3T1zyZWzpeGyOGNyvTe4QqEKjPIIhyUvyeznIB_GqKyFFolGhsSuRvk6XQ8CkvZRt6muagiw-d31w-M-cejmZ1BDnOVNtEYEV9OAW3RotyHFm-u13_8ltHcGoV4IXEv1jXqdz027CZ1fxMP6zvl7dnTVkhyWPYXXk57s_4TuYPrhWyTPs7_RXtWTKvDDPkizSG74eM2yanIYpxv-Smnc3I24nSESDgzoMDP_RTjB3qZCH-3FqkprkjH7UhB8GT31VMvrpelySQ==&p=14&fvj=0&vjs=3
Java Developer (Entry Level),www.advantecs.com,4 days ago,United States,"$55,000 - $65,000 a year", Shortlisted candidates will have initial interview with the Employer t and selected candidates will be on-boarded into a Corporate paid internship upskilling…,https://www.indeed.com/pagead/clk?mo=r&ad=-6NYlbfkN0DIjBdOhcvN-vt2b7UpMuy1LIBG3msLj6vp7TuM2Ezbx0WFT323hYkzSzzDgW0oVmEPfOXyFIXIVGJJ7Lyoy5L7iPSGf_Y4T3hkXmUnDaYuNWjthhu83GA4a3H6bP5CPQ_23rw9pB2lN6gMP2Z3sbw3n05nT66iLHIrgcO6nvG5X54RlW0SP5gNP_4uRJICSG11ZtZ9RfeybDyl-stYB8NiXsbIIguNnoYfwtZnfryaI_AOXedEChR7Q-8KzWNLFhQgZVR48_oJJsBSvChQnYEucl6H0XbzIyGKUClkilwko8AnmKNSjwzJ3tQsNonJKzHnl5RChXeAEAaGBa9CQoL7ij6XjCwCXk7qUAR5foSUxZgkC7NpH2iqIg-QL6NpRXVbbLMZIyYRaaY4vi0E0escEEvvxj_mR0B4pjk23HA6JAt97Myx0yYZfA4YVI4ifCAEo90Nt7UEgSkrK9xSdZS4-wN6_oIC7tA=&p=15&fvj=1&vjs=3
Entry Level - Software Developer,Smoothstack,25 days ago,United States,"$55,000 a year"," Basic knowledge of Java, C#, .Net, Python or similar programming languages.New college graduates are welcome to apply.",https://www.indeed.com/pagead/clk?mo=r&ad=-6NYlbfkN0ChdE_-3s9UeG5xYsqO3th9AddXeBq2OieSfAM8evhI-PZ76-Buf7EcnCv0gKKLndR0YEV2kTxuAD_VKH6HEbZFGsVNkpiitjOp_daSiXpE3Pd_X3qe-bekUwRlgzVovAcCBt0z5yUU5xFBeE38vP8NN1cwM2zQW5_7-qCme8EqiiMFCG2Ay2jE2TmCnLQ24AHylZKFuZbr8f25LDKMKbZ8ZZ810u306Ywb3AoikIA5id9qEyMau9uPs2CBaxNPEfl3FXTLt1NLp63aFcE5pn38CQpvxNCg0LaFq3vm_JrE1mrV1vMwjd-oLWMdIoSlKKr8BMN9GDEU--zq43ZN2FNLjFY7jMYKAbGQRpisWOqbkChV2bi4nv5ek4kcMxQ3YoLuq13Jzf8sJWslnBeW-AqfkIk00onhN1dZXajv0mo2X50cGKUAcyD9jFTA1I_KVQRrRUfccILlrjjoKM_Qog6IZAL1D5PrMZA=&p=16&fvj=1&vjs=3
Software Engineer,Complion,26 days ago,"Cleveland, OH 44115 (Downtown area)",no data, Complion recently won “Best Growth” and “Startup of the Year” and we’re looking for an up and coming Software Engineer to join our growing cross-functional team…,https://www.indeed.com/pagead/clk?mo=r&ad=-6NYlbfkN0C8fsZAUwot6QlMprF6kLU8IkgjbiU5mN9OqR1WV3Drrrq7INcsIBLuBUt8JeBO45Yknz7n6s-nogG6UnQiMrBzXq7ojDMkM1DaEFD3gfvvZDQkwe7wx2nT-8IVgu2hgx48BOA2gF326ZSZTSAVbsYO-0HJ1qp85pK9LHJRVthALWH-KCKiLAEs-aZigVPsKMQrbPEDTWZ2Ekt8Jj7pO771z5BJVBabwKGpJXdX-NVQ-aDlY9E2Dxr7sASikomdF1NqCaxlgXIS3Z8e691V91p3l2blQxLNqwoXKLtRJQQ62Ml7I-K22Uk0JwY2F_0Q3XFxsReW98Nl3hkFC_LZG_W_56WM8NNvtB6IsSrKZtiI2TnQsPy_Ri5bnJryEvTgY51Jeq5PBHjpxWFQcSOlwmSLHqbp2RKDJqeGRnNycz3wNcZKoiM6BSFk166xIswbZY8ZQKHoVMgB_EMGavSEZirx&p=17&fvj=1&vjs=3
D365 AX Developer,Agility Business Solutions,30+ days ago,"Cleveland, OH",no data," What you’ll do as a Developer:HTML5, CSS, JavaScript, ASP, Python, XML and SQL skills are a plus, as is familiarity with Microsoft Visual Studio development…",https://www.indeed.com/pagead/clk?mo=r&ad=-6NYlbfkN0Bx1fXn6alTMpFeDNCF4CS42N3f1cgysk8lkLxcSpX4r2tjKoEiTmILkqOeTpt8w6M9xPUEsPPWrwtHl7Jg2l6-UGik6s7fVaCVVXxQ0YRWcY_UB8gB-k5HDLL5rXceEPhIN2hSF1525NWnZGngTWbtuvtJsBjNDpoDhIXXGOt0Anjc2b79PKbz-8T2M6LloHIwwhyBZahAWcnz5zOBm1M9cxnx6sth2IqARxn5iQvyOoptFZyCXCywOXt_Vdc4rohT8PgsoGxmcSKm61uOGr4HvTf16brDF71zl32RUgs3OmhezO69x1ZnM7pf9UQq2EV_2bwhopwHwtMEa-hFYPGwZSCmzqSmFrfdfzvY-jcJDtp9el04ZP-4BClRRGZtTBx-NMVGH001_XYbyJJC05ySISyup_w5O4xVU2PPeyES41SdbjoaoR1PslBQcQGGq0uccRWz16Yy2FzrgpvuhkUIO7UvM6f2sAg=&p=18&fvj=1&vjs=3
Data Engineer II,Windstream Communications,26 days ago,"Twinsburg, OH 44087",no data, Work within the structure of an agile / scrum development team.Experience at working within all levels of the software development lifecycle from requirements…,https://www.indeed.com/rc/clk?jk=f869adef8c5bf616&fccid=035bef51686ff9d1&vjs=3
Senior Data Engineer,Key Bank- Corporate,30+ days ago,"Cleveland, OH 44113 (Tremont area)",no data," Extensive experience in Bash script, Python, R, SAS, SQL, BigSQL, etc.Design and implement Python, R or SAS routines or scripts to the production environments…",https://www.indeed.com/rc/clk?jk=06e10c8db12940d2&fccid=23db8b01ff3384c2&vjs=3
